rating,tanggal,ulasan,sentimen,,label
5,8 tahun lalu,"""Goro Asalam"" ini, boleh dikatakan mall berciri khas Islam. Lokasinya besar dan luas, berada di tepi jalan raya Semarang Solo yang ramai dan padat. Dekat kampus UMS, tetapi bersebelahan dengan Rumah Sakit Islam Muhamadiyah, jalan menuju ke Kerten. Barang-barang yang ditawarkan lengkap, dari sembako sampai ke busana, kuliner, dan elektronik. Di sini juga sering diselenggarakan event-event besar, misalnya seminar, pameran buku, pameran komputer, dan lain-lain. Buka setiap hari dan pengunjungnya banyak.",positif,,2
4,4 tahun lalu,"Lumayan lengkap supermarketnya, tapi ada perubahan tempat barang-barang, jadi yang udah terbiasa ke sana mungkin harus ngafalin tempatnya lagi. Parkir gratis, ada banyak kucing jugaa",positif,,2
5,7 tahun lalu,"Harga barang nya cukup murah, ada mamber khusus untuk diskon kalo mau di jual kembali.
Parkiranya luas
Masjidnya gedhe banget.
Ada taman bermainya.
Biasa buat belanja mebel",positif,,2
3,5 tahun lalu,"Lengkap sih, luas sih, murah juga. Tapi selalu kepanasan kalo belanja kesitu.
Paling sebel kalo lagi ada bazaar yg makan parkiran, sebelnya ampe ubun"" 😖😖",negatif,,0
5,3 tahun lalu,"Melanja mudah, murah dan berkah.",positif,,2
5,8 tahun lalu,"Tempet belanja yg lengkap,bisa belanja krbutuhan sehari-hari,kuliner banyak warung makan ada soto giyem,stik.bebek pak s lamet dll,furniture,istirahat sholat karena ada masjid yg besar n parkiran luas juga ada bursa jual beli mobil pokoknya lengkap",positif,,2
5,6 tahun lalu,"Hypermarket ini adalah hypermarket yg lengkap dan murah dr peralatan rumah tangga,baju,sepatu,buah,daging,ikan,camilan"" Dll ada dan harganya beda dgn yg lain lebih murah disini kadang ditempat ini ada pameran-pameran,ada showroom mobil jg,tempat parkir luas,masjidnya jg besar,kalau nggak salah ada tempat berkudanya juga",positif,,2
4,7 tahun lalu,"Tempat belanja dengan harga terjangkau. Disini juga menjual baju2 dengan model kekinian. Walaupun mall ini belum begitu ramai. Tapi, aku rekomendasiin buat kalian yanga mau belanja bulanan dengan harga yang terjangkau. Foodcurt disini juga enak2 masakannya ga kalah sama mall2 lain",positif,,2
5,6 tahun lalu,"Parkir gratis dan area parkir luas,meskipun gratis tetap aman karena ada karcis parkirnya.harga juga murah dan isi komplit banyak pilihan,sering ada event yang menghibur dan menarik terutama untuk anak-anak seperti event lumba-lumba yang belum lama ini ada.lokasinya juga terletak dipinggir jalan raya sehingga mudah terlihat.",positif,,2
5,6 tahun lalu,"Tempat berbelanja kebutuhan rumah tangga yg cukup lengkap denga harga yg lebih bersaing dibandingkan hypermarket lain.Tersedia fasilitas yg cukup memadai termasuk  masjid ,tempat parkir dan tempat kuliner setempat.Juga terdapat tempat jual beli mobil bekas di area parkir dengan banyak pilihan.Tempat ini menjadi pusat kegiatan ekonomi dan kegiatan keislaman di area Kartosuro.",positif,,2
4,10 tahun lalu,"Lengkap deh jenis produk yang dijual, disini dijual pula busana dan alas kaki yang murah dan didiskon hingga 50%. Ada toko buku juga. Ada toko roti. Ada tempat permainan dingdong. Disamping mall ada banyak warung makanan. Parkirnya gratis.....",positif,,2
5,7 tahun lalu,"Pusat perbelanjaan buat para muslimin di solo nih. Cocok banget. Suasana yang Islami apalagi kalau ngepasi ada bazar buku murah disana dan acara kajian. Ayo-ayo, wujudkan kebangkitan ekonomi umat muslim dengan belanja di Assalaam Hypermarket. Keuntungan dari hasil perbelanjaan kalian akan disalurkan kepada pihak yang membutuhkan.",positif,,2
4,4 tahun lalu,"Komplit, harga barang2nya lebih murah dibanding toko grosir lain semacam Lottemart. Plus di waktu2 tertentu banyak promo2 & diskon. Plus lagi klo punya kartu pedagang harganya ada diskon lagi",positif,,2
1,3 tahun lalu,"Mantap, tanggal 21 des 2022 jam 09.53 WIB belum buka, padahal di web tertulis buka jam 08.00 WIB. Percuma ngunggulin kesan Islami tapi kualitas manajemen operasionalnya kek gini.",negatif,,0
5,8 tahun lalu,"Saya suka tempat ini karna tempat bermainnya sangat banyak sekali dan ada masjid dan tempat belanja nya sangat rapi dan mudah di cari orang dan ada yang menjual mobil ,makanan,dll. Dan yang paling saya suka adalah tempat parkir mobil atau motor sangat rapi dan kasir nya ramah dan baik dan sopan santun sekali 😊😊😊😊😊😊😊😊😊😊😊",positif,,2
5,5 tahun lalu,"Ready Stock
-Kemeja Jetbus Mercedes Benz harga Rp.130.000 diluar ongkir
Ukuran L,XL , XXL
-kemeja Sudiro Tungga jaya harga Rp.130.000
Ukuran L,XL,XXL
-sticker cutting
Harga diluar ongkos kirim dari kota solo
Order wa 081542870799",netral,,1
4,7 tahun lalu,"Tempat yang luas sampai-sampai capek muterin, ada dua tempat bermain, satu di depan satu di belalang kalo masuk buat belanja langsung lurus lahh itu tempat mainnya, beli buah disini lumayan murah bisa per ons, beli naget disini juga murah bisa perons juga pokoknya beli makanan disini boleh per ons, kalo mau cek harga disini juga ada pengecekan harga gak harus ke kasir buat mastiin harga, pelayanan ramah gak pake teriak"" gak pake lama... Kalo belanja kesini gak usah takut dempet""an soalnya luas sekali..,",positif,,2
5,5 bulan lalu,banyak banget promonya,positif,,2
5,6 tahun lalu,Tempat nya luas. Masjid nya bagus. Sering ada pameran buku dan fashion juga acara² menarik. Untuk pusat perbelanjaan tdk kalah dgn yg lain.,positif,,2
4,4 tahun lalu,"Tempatnya luas, mudah parkir, cuman didalam gedung nya Kurang tertata rapi, semoga kedepan nya bisa lebih baik lagi.",,,
5,5 tahun lalu,"Tempat belanja segala kebutuhan, lengkap, murah dan barang semua berkualitas. Pelayanan sangat baik dan ada banyak promo dan undian berhadiah umroh mobil motor tiap tahun. Mantap!",netral,,1
4,5 tahun lalu,"masih sama seperti dulu waktu di solo

tak banyak yg berubah

kesini klo pas lg ada pameran aja

pas ke solo eh proyek purwosarinya mangkrak 😑

mengganggu liburanku saja 🙄 ya gitu dah",negatif,,0
5,7 tahun lalu,"Belanja kebutuhan rumah tangga
Area strategis deket universitas muhammadiyah surakarta
Buah"" an segar tempat nyaman dan menyenangkan
Baju koko dan mukenah semua komplit
Dijamin puas 👌👌 pelayannan nya
Disana juga pernah di adakan pameran komputer apkomsa
Mempermudahkan mahasiswa dalam berbelanja 👍🙋
Barang komplit dan banyak foodcourt juga
Ada taman bermain anak""
Enjoyable lah",positif,,2
5,7 tahun lalu,"Tempat belanja ternyaman, apalagi pas ada event pameran buku dan baju muslim ini, bukunya pun menarik, harga baju pun oke dikantong mahasiswa, disana serasa ingin membeli semua bukunyaaa, kalau bisa sih event seperti itu diperpanjang waktunya 😂",positif,,2
3,10 tahun lalu,Parkir motor gratis. Tempat parkir motor tidak terlalu luas. Di dekat Goro ada masjid besar yang cukup representatif untuk salat. Bagian dalamnya luas. Sering ada pameran buku di sini.,positif,,2
5,setahun lalu,"Dekat dengan rumah...lengkap, bersih, parkir luasssss.... barokallah assalam Hypermart...maju terus dan sukses aamiin 🤲 👍",positif,,2
5,7 tahun lalu,Tempat belanja yang terletak di daerah Pabelan Kartasura ini menyediakan berbagai macam kebutuhan harian Anda.... Selain supermarket ada juga kios-kios yg menjual busana muslim...mainan anak.... Toko buku juga ada di bagian depan.... Tersedia juga pusat jajanan dan arena bermain games.... Ada juga masjid yang terletak di bagian luar... Tempat parkir juga luas.... Di sini juga sering diadakan book fair,positif,,2
3,6 tahun lalu,Tempat bagus dan lengkap tapi jum'at kemarin saya belanja di hypermarket..kebetulan lagi buru2 sampe rumah baru cek nota dan ada 1 barang yg ga saya beli masuk di nota.. saya cek di plastik belanjaan barang tersebut juga ga ada..padahal harganya lumayan mahal tuh barang..jadi agak kecewa sih bagian kasirnya kurang teliti..,negatif,,0
5,4 tahun lalu,"Aku 2x beli kacamata di selatan kasir, mbak nek kamu baca ini dan masih inget aku yang kalo beli kacamata malah minta pendapatmu ""cocok ga?"" itu aku, dan aku juga mau foto bareng kamu mbak hehe. Trus nanti fotone ben bisa di upload di review sini. Tapi nek wes ndue suami gak sido.",netral,,1
4,7 tahun lalu,"(+ tempat belanja kebutuhan sehari2 yg lengkap dari ujung rambut sampai D394 dari pakaian sampai perabot rumah tangga
+ ada juga lapak kuliner di bagian depan
+ parkiran luas, gratis, ada pepohonan rindang sehingga tidak panas 👍
+ harga relatif murah, walaupun kadang ada beberapa produk di tempat sebelah lebih murah
+ lorong antara rak barang/produk luas
+ ada masjid
+ ada tempat bermain untuk anak2
+ suasana islami
- hawa udara di dalam kurang sejuk, saya agak kegerahan
- pilihan merek terbatas",positif,,2
5,Diedit 7 tahun lalu,tempat parkir luas dan gratis mantap. suasanan berbelanja pun enak ndak begitu sremawut tapi kalu pas rame ya begitulah. tempat bermain juga lumayan menghibur untuk refresing anak2 sudah cukuplah.....,positif,,2
5,7 tahun lalu,"Parkir sangat luar biasa luas & Gratis.
Banyak shelter makanan.
Banyak digelar event.
Memiliki masjid yg sangat besar,bersih,& nyaman.",positif,,2
5,4 tahun lalu,"Alhamdulillaah... Tempat belanja modern yg sangat Islami. Ada masjid, halal food dll. Cuma sayangnya akses ke masjid dari mall tdk ada atap jd kalau hujan ya kehujanan. Bagi pengelola tolong ya dikasih atap dr mall ke masjidnya. Terima kasih n Jazakumullohu khoiron katsiron.",positif,,2
5,Diedit 5 tahun lalu,"Menarik banyak tempat refreshingnya, cuman sebagai Hypermarket Muslim kurang berkahnya kalau tidak ada spanduk 8 ajaran berdagang ala Rasullulloh saw di luar dan di dalam Hypermarket dan dipatuhi semua pedagang. Semoga management cepat menanggapi pentingnya dan jadikan suatu gerakan pilar-pilar Islam dalam prinsip berdagang. Terima kasih.",netral,,1
5,6 tahun lalu,"salah satu swalayan yg mengusung suasana islami,dng tmpat yg luas dan nyaman untuk berbelanja bersama keluarga,,dsna ad jga fasilitas masjid yg cukup besar darea dpan swalayan,,co2k untuk rest area karna letaknya yg ad dpggir jalan raya solo-kartosuro,,,manstab",positif,,2
5,6 tahun lalu,Paling nyaman untuk belanja...aman jika bawa anak kecil. Harga muraahh...banyak diskon utk hari2 special. Yang paling keren...suara adzan terdengar d dalam market..masjid pun dekat dan nyaman 😍,positif,,2
5,7 tahun lalu,"Pusat perbelanjaan di daerah Sukoharjo,tempatnya luas.di luar bagian depan ada semacam bursa mobil,di depan pintu masuk ada bbrp penjual makanan,di sebelah barat ada food court dan masjid yg cukup besar.begitu masuk ada bbrp stand penjual pakaian, supermarket agak masuk ke dalam.dgn bagian Frozen ada di ujung blkg.di dpn sblh kanan ada wahana bermain.di blkg Goro assalam sekarang ada wahana berkuda",positif,,2
5,6 tahun lalu,"Assalam hypermarket tempatnya sangat nyaman dan luas.tempat parkirnya ok.anda dapat menemukan aneka kebutuhan sehari hari disini.anda juga dapat bermain sepuasnya dengan anak anak anda karena disediakan tempat khusus untuk bermain anak anda. Bila lapar, anda tak perlu khawatir..aneka macam masakan sudah tersedia dan anda tinggal pilih mau makan apa",positif,,2
5,7 tahun lalu,"Hypermart lengkap Dan harganya pun myrah2 dibanding dengan hypermart sejenis ... Ada tempat bermain utk anak2nya jg,,jd anak bisa bermain ditemani papanya sedangkan mamanya bisa belanja dengan tenang ... Tp memang tempatnya tdk sebagus dan senyaman mall lainnya,,parkiran cukup luas utk tempat makan jg Tidak banyak pilihan",netral,,1
5,6 tahun lalu,"MasyaAllah,
Tempat berbelanja kebutuhan rumah tangga, alat tulis, reparasi, dan lain-lain dengan harga yang cukup terjangkau.
Tersedia juga masjid, rumah makan, area bermain, toilet, tempat parkir.

semoga berkah",positif,,2
5,8 tahun lalu,Tempatnya luas..  Ada food garden kalo lapar habis belanja tinggal pilih mau makan apa..  Yg pasti halal disini..  Disini juga sering ada pameran..  Trs yg penting nih...  Disini nih parkir nya gratis..,positif,,2
4,8 tahun lalu,"Assalaam Hypermarket salah satu supermarket (dulunya Goro) tempat berbelanja kebutuhan / keperluan sehari hari, terlengkap sangat komplit dari pakaian hingga perlengkapan rumah tangga, harga lumayan murah dan tempatnya  sangat strategis tepat di jalur luar kota menuju Semarang maupun Yogyakarta, ada tempat bermain anak, tempat parkir luas dan gratis.",positif,,2
5,8 tahun lalu,Mesjidnya besar dan cukup luas. Ke sini biasanya pas Islamic Book Fair dan pameran-pameran sejenisnya. Arena bermain bagus ada trampolinnya.,positif,,2
4,4 tahun lalu,"Swalayannya besar eh iya kan namanya aja ada Hypermartnya hehehe...

Lengkap isinya... Ada bbrp promo.. banyak tmpt makan dan bnyk kebutuhan yg lain...

Punya pengalaman disini cari parkir motor kesusahan padahal ada tanda cuma ga perhatikan sampe tanya orang hehhe...",positif,,2
5,7 tahun lalu,Ada beberapa item yg lbih murah di bandingkan dgan yg laen,positif,,2
5,2 tahun lalu,"Tempat luas, barang komplit, harga terjangkau,recomended untuk berbelanja bulanan :)",positif,,2
4,5 tahun lalu,Parkir luas dan gratis. Banyak produk muslim. Masjid besar dan nyaman. Banyak jajanan dan sering ada pameran buku dan produk muslim. Tempat bersih dan nyaman.,positif,,2
5,7 tahun lalu,"Tempat belanja yg sangat terjangkau. Berbagai macam kebutuhan ada. Sy biasanya cari bahan yg cukup sulit disini, spt telur ikan, otak sapi, dll. Harga cukup terjangkau. Lokasi jg cukup strategis",positif,,2
5,4 tahun lalu,"Selalu kangen... Ke GORO assalam... Karena, tempat strategis, belanja kebutuhan sehari2 lengkap, shelter makanan juga enak dan lengkap harga terjangkau... Dan pastinya masjid nya... Di area yg sama .. So belanja makan maen tapi sholat tetap terjaga.. Recomended banget. 💜",positif,,2
5,8 tahun lalu,"Tempat belanja favorit
Parkir luas
Harga terjangkau
Akses sangat mudah
Ada masjid besar dan indah
Banyak jual makanan
Diingatkan waktu adzan
Ada tempat wahana bermain anak",positif,,2
5,3 tahun lalu,"Masyaallah belanja disini lengkap, pelayanan oke, parkir luas, yang terpenting kejujurannya luar biasa kembalian 100 200 rupiah pun dikembalikan salut",positif,,2
4,4 tahun lalu,"Tempatnya nyaman. Masjidnya luas, food court juga lengkap menunya. Kamar mandinya bersih. Kadang ada event pameran juga 😊👍",positif,,2
3,7 tahun lalu,"Mall bernuansa muslim berlokasi didaerah pabelan kartosuro dipinggir jalan raya kartosuro - solo, dekat dengan kampus ums juga transmart. Hanya tersedia mart lumayan Komplit juga beberapa counter busana. Tersedia juga arena permainan anak. Sering dipakai pameran buku muslim. Disebelah luar tersedia food counter yg cocok dipakai buat santai. Di halaman depan dipakai buat jasa jual beli mobkas. Tersedia masjid, toilet dan parkir yg memadai",positif,,2
5,5 tahun lalu,"Tempat belanja nyaman dan parkir luas. Lengkap dengan tempat ibadah yang representatif.
Sholat jum'at nggak kawatir ketinggalan karena adzan dikumandangkan sampai ke dalam Mall.",positif,,2
5,4 tahun lalu,"Tempatnya bersih,rapi, food court nya oke, tempat berkuda juga ada, buah-buahnya selalu fresh, novel dan baju-baju juga ada, karyawannya patuh prokes juga",positif,,2
4,8 tahun lalu,Lengkap. Harga bersaing. Ada foodcourt & tempat main anak. Masjidnya nyaman & kmd nya bersih. Klo di teras masjid ada atapnya saya kasih bintang 5,positif,,2
5,7 tahun lalu,"Tempat belanja yg nyaman dan lengkap , tempat parkir luas, ada masjid yg besar disampingnya shg tdk keburu kalo saatnya sholat, ada jajanan jajanan ringan diarea depan dan samping",positif,,2
5,7 tahun lalu,"Tempatnya belanja luas....buah2 segar...ikan segar
T4 bermain ada 2...diluar hypermarket atau di dlmnya....
Tempat solat luas...
Tempat mkn jga ada...cemilan di dpn bnyk bgt...
Kl hari ini ada bazar...",positif,,2
5,5 tahun lalu,Grosir dan tempat belanja yang lumayan murah jadi recommended... Dan juga banyak toko2 baju yang fashionable... Untuk ikhwan dan akhwat... Ada juga penjualan bermacam2 qur'an... Bahkan alat2 olahragapun ada...,positif,,2
5,5 tahun lalu,"Tempat belanja yang aman,nyaman, komplit mudah dicari barang yang dibutuhkan karena tertata rapi dan ada petunjuk nya, pelayanan memuaskan,lokasi pinggir jalan raya solo Semarang",positif,,2
5,Diedit 4 tahun lalu,Nyaman ajah... suka tempatnya komplit,positif,,2
4,4 tahun lalu,tempat nyaman untuk berbelanja kebutuhan bulanan,positif,,2
5,7 tahun lalu,"Tempatnya luas, palung suka kalo kesini nyari sayur segar buah2 sama jajanan klo pas ada acara book fair",positif,,2
5,8 tahun lalu,"Tempat belanja yang dilengkapi food court dengan berbagai pilihan makanan, berbagai snack dan minuman yang dijual pun ada, masjid yang luas, area parkir yang luas, rest area yang memadai, tempat bermain funcity dan kids fun untuk anak tersedia,  swalayan yang terbilang komplit, serta ATM corner yang dapat digunakan untuk mengambil uang tunai.",positif,,2
5,6 tahun lalu,Lengkap kit detailer premium dll.,positif,,2
5,4 tahun lalu,"Tempat belanja segala macam keperluan rumah tangga dari makanan, perabotan sampai otomotif, dilengkapi fasilitas ibadah masjid nan megah dan bersih membuat ketenangan anda dalam beribadah dan berbelanja",positif,,2
5,7 tahun lalu,"Lumayan lengkap, tempat besar, harga lebih murah drpd di supermarket pinggir jalan, terdapat ruko-ruko busana muslim dan makanan, ada masjid, salon, wahana permainan",positif,,2
5,7 tahun lalu,"Tempat belanja yang nyaman. Barang- barangnya cukup lengkap. Rame banget kalo pas ada pameran, karena EO nya pameran kreatif. Ada talkshow kewirausahaan, talkshow muslimah, ada lomba anak- anak juga.",positif,,2
5,5 tahun lalu,Masjidnya luas dekat perbelanjaan orang jual makanan juga banyak. Masjidnya cocok sekali buat yang lagi perjalanan dan bingung mau singgah di mana,positif,,2
5,7 tahun lalu,"Supermarket yg agak konvensional dalam tata ruangnya.produknya komplit , cuman kurang menarik penataannya. Karyawan ramah2. Parkir sepeda motor gratis. Harga relatif lebih mahal dibanding Luwes grup",netral,,1
5,4 tahun lalu,Langganan bulanan disini. Untuk harga sembako makanan minuman buah lauk pauk murah lah. Tp jangan sekali kali beli peralatan rumah dan instalasi rumah harganya diatas rata rata,netral,,1
4,7 tahun lalu,"Belanjaan lumayan murah, foodcourt banyak banget ada masjid besar banget u ukuran pusat belanja, ada berkuda n memanah parkir gratis selama apapun",positif,,2
5,4 tahun lalu,"Tempat belanja nyaman & harga bersahabat. Parkir luas dan gratis 😁 dekat dengan masjid, jadi mudah cari tempat sholat.",positif,,2
5,4 tahun lalu,Fasilitas pajak kendaraan bermotor setiap hari Sabtu mulai jam 09.00 di area parkir roda 2. Antrian sudah buka jam 08.00,netral,,1
4,5 tahun lalu,"Area belanjanya luas, produk beragam, harga bersaing, dan yang paling penting adalah jumlah kasir yang memadai terutama di saat-saat ramai seperti menjelang Idul Fitri.",positif,,2
1,3 tahun lalu,"Semoga ada petugas assalam hypermarket yg mengingatkan orang2 kek gini , udah tau itu jalan umum , kalau mau nongkrong jangan disitu! Banyak orang yg jadi susah lewat , terutama yg lewat pake troli",negatif,,0
5,6 tahun lalu,"Tempat luas dan cocok buat liburan apalagi di goro assalam ada permainan(harus beli koin untuk bisa main permainan) dan tempat berbelanja seperi makanan ringan, minuman, lauk, dan jajanan. Dsb",positif,,2
5,6 tahun lalu,Lengkap dan harga relatif murah dengan pelayanan yf baik dan temoat parkir yg luas untuk kaum muslim bisa sholat di masjid di area tersebut yg yg bersih dan nyaman,positif,,2
5,Diedit 3 tahun lalu,Semoga lbih banyak promonya,netral,,1
5,Diedit 6 tahun lalu,"Tempat belanja yang sangat lengkap...
Di lengkapi masjid yang cukup besar di dekat pintu masuk...
Saat waktu sholat tiba, Bahkan suara adzanpun terdengar sampai ke dalam, jadi saat berbelanja tidak perlu khawatir kita bakal kelupaan waktu sholat...",positif,,2
5,Diedit 7 tahun lalu,"Well, salah 1 supermarket yang wajib dikunjungi oleh sesama muslim
Bukan berarti yang non ga boleh ke sini ya hehe.

Parkir gratis. Pelayanan bagus.

Sering ada promo. Jadi jangan sampai ketinggalan belanja klo ada promo super murah gituh.",positif,,2
5,4 tahun lalu,"Startegis, lengkap, terjangkau. Banyak jajanan di depan lobby.
Ada masjid yg nyaman, cocok untuk beristirahat sejenak saat perjalanan",positif,,2
5,5 tahun lalu,"Tempat luas, parkir luas, kalo laper... Ada foodcourt yg byk pilihan. Dan lg ada masjid yg nyaman tuk ibadah",positif,,2
5,Diedit 6 tahun lalu,"Tempat belanja yang luass, semua kebutuhan adaa. Harganya juga enggak mahal, kassanya banyak jadi gaperlu antri lama. Parkirannya juga luas bangett dan ga bayar parkir loh",positif,,2
5,4 tahun lalu,"Tempat belanja yang nyaman, aman, harga murah dan bersaing, komplit segala kebutuhan banyak promo tiap hari parkir luas",positif,,2
5,4 tahun lalu,"Luasss, nyaman kalo bawa anak!! banyak promo dan ada undiannya tiap tahun.. semoga dapet undian mobil tahun ini.. aamiin 😁😁",positif,,2
5,7 tahun lalu,Belanja mari belanja dan nikmati food garden hanya di assalaam hypermart,positif,,2
5,7 tahun lalu,Murah meriah tapi ngga murahan.. Pelayannya ramah tamah..,positif,,2
4,4 tahun lalu,Salah satu hypermarket yg cocok untuk memenuhi berbagai kebutuhan rumah tangga. Terdapat Beragam baju muslim dengan kualitas yg bagus👍 di lengkapi dg fasilitas yg memadai.,positif,,2
1,2 tahun lalu,"Ah bodo lah manajemen nya, mau makan soto aja jalannya jauhhhhhhhhhh parkir segala dipindah",negatif,,0
1,4 tahun lalu,"Mohon kebijakanya dalam jual minyak subsidi jgn dipersulit,msak harus diwajibkan beli margarin 2pcs setiap pembelian minyak??kami ingin beli sesuai kebutuhan aja jgn dipaksa beli yg g dibutuhkan,dalam ajaran islam pun tidak diperbolehkan.makasih",negatif,,0
5,4 tahun lalu,"Parkir gratis & ada showroom mobilnya, jadi kalau nganter istri belanja bisa liat2 mobil. Meskipun gak beli 🤣🤣🤣",positif,,2
3,7 tahun lalu,"Kita bisa bermain dan berbelanja jika ingin ke masjid juga ada dan juga bisa bermain di kid fun, scooter, berkuda tempat berkuda didekat parkir motor / dekat pintu belakang dan bisa menggunakan kartu pas untuk berbelanja di assalam hypermarket",positif,,2
5,8 tahun lalu,"Satu satunya Hypermarket dengan masjid yang nyaman dan layak di kota solo..kita bisa menghabiskan banyak waktu untuk berbelanja, bersantai, kuliner, dan bermain bersama keluarga tanpa tertinggal sholat berjamaah dimasjid.",positif,,2
3,5 tahun lalu,saya suka krn tempatnya luas dan alat2 rmh tangga yg jrg di store lain ada dsini.. buah .. sayur.. daging fresh.. tempat pameran jg ada..parkir lega n free lg..😊 menyenangkan bukan.. ayo ramein goro assalam lg..,positif,,2
4,4 tahun lalu,Suka aja karena nggak terlalu padat jadi bisa leluasa blanjanya. Penataan msh sama... Need something woww buat menarik minat pelanggan... 💜 💜 💜 Tetap semangat dan sukses ya,positif,,2
5,5 tahun lalu,"Jajanan banyak, parkir luaaasssss, gratiiisss pulaaa. Masjid sangat sangat nyaman untuk ukuran masjid pinggir jalan raya. Suka belanja disini, membangun keekonomian ummat 🙂",positif,,2
5,Diedit 4 tahun lalu,"toko assalam termasuk hypermarket yang komplit untuk perbelanjaan mulai dari kebutuhan rumah tangga hingga pertukangan, terdapat promo disetiap produk baru dan setiap mamber tetap akan mendapatkan point yang dapat dikumpulkan untuk hadiah undian diakhir tahun.
pusat perbelajaan yang tepat dan harga bersahabat
suka belanja disini karena tempatnya teratur dan bersih
terus pertahankan kualiatas pelayanan offline maupun onlinenya
mantapss 👍👍",positif,,2
4,7 tahun lalu,"Recomended buat beli perlengkapan ukhti2 dan akhi2, iyaa kalo di bazarnya murah2 tapi kalo di hypermarketnya harganya miring tapi yaa itu ada yg mahal. tempatnyaa luas lengkap dengan fasilitas umum. tapi panass",positif,,2
5,4 tahun lalu,"Tempat belanja bulanan dengan harga sangat terjangkau, selama kuliah di UMS selalu belanja di sana, parkiran motor dan mobil sangat luas, ada masjid juga.",positif,,2
5,Diedit 4 tahun lalu,"Tempat belanja komplit. Luas. Ngga desak² an meski rame. Masjid tersedia, nyaman pula tempatnya. Jajanan buanyakkk bgt.",positif,,2
5,7 tahun lalu,"Top ini mah, tempat nyaman, komplit, parkiran luas, masjid besar dan nyaman jd gk khawatir waktu belanja.....rutin ada pameran buku islam...👍",positif,,2
4,7 tahun lalu,"Supermarketnya kurang lengkap dan minim promo potongan harga. Tapi ada counter khusus peralatan pertukangan yang lumayan lengkap.
Parkirannya sangat luas, dan ada pusat jual beli mobil second-nya.",netral,,1
5,5 tahun lalu,"Harga terjangkau, bersih
Fasilitas : toilet, masjid, halaman parkir luas dan gratis, foodcourt, arena bermain anak, pacuan kuda",positif,,2
1,setahun lalu,"Berangkat ke assalam pulang2 wassalam hilang sepatuku di cantelan motor, sebelumnya temenku juga hilang belanjaannya sebelumnya tapi ketemu",negatif,,0
4,Diedit 7 tahun lalu,"kesini nya xlo ada momen book fair, bsa liat2 sambil belanja. nyaman belanja dsini ketimbang supermarket lain. parkir gratis, t4 luas",positif,,2
5,7 tahun lalu,"Assalaam hypermarket cocok digunakan untuk kulakan pedagang karena dengan harga yang murah dan jika memiliki kartu member bisa mendapatkan harga yang lebih murah lagi.
Fasilitas yang dimiliki cukup lengkap yaitu terdapat masjid ,foodcourt,parkir yang luas,showroom mobil,dll",positif,,2
5,Diedit 4 tahun lalu,"Toserba yg lengkap dan islami, parkir luas, mesjid nyaman, ada foodcourt, ada fresh food, parkir gratis, ada atm dll...nyaman dan harga terjangkau, banyak promo",positif,,2
4,7 tahun lalu,"Parkir luas, ada masjid...
Musik area kantin bisa d pelankan volume nya",positif,,2
4,7 tahun lalu,Cocok buat belanja kebutuhan rumah tangga sebulan..harga banyak yang paling murah..parkir luas gratis lagi..dan ada masjid nya yang megah 👍,positif,,2
5,Diedit 7 tahun lalu,selalu belanja bulanan di sini...parkir luas..tempat luas..bawa anak kecil aman..masjid besar jd kalau blm sholat g khawatir dan bingung nyari tempt sholat..belasan tahun mjd custumer setia di sini,positif,,2
